{
  "version": 2,
  "profile": "standard",
  "package": {
    "name": "agentflow-sdlc",
    "version": "1.2.0"
  },
  "planToken": "025bf38570a6e9ca5370c4f4d48d9dbe34e099d2b6d2c7b4cef3f7d23e6dc452",
  "entries": [
    {
      "source": "defaults/agent-workflow.config.json",
      "target": "agent-workflow.config.json",
      "ownership": "seed-once",
      "state": "managed",
      "hash": "689be5292ce1bb8771ec0b4e2c7980ea720ac442e1636893c56bae3c1772dc47"
    },
    {
      "source": "defaults/AGENTS.md",
      "target": "AGENTS.md",
      "ownership": "seed-once",
      "state": "managed",
      "hash": "c46a05acb961e33e2f1bd5ffb31d08e8de151fea62da450b6d71461bf35ea82f"
    },
    {
      "source": "docs/adopters/index.md",
      "target": "docs/adopters/index.md",
      "ownership": "managed",
      "state": "managed",
      "hash": "2b6f383c3af1cf854b8e4e4e8f05b12fc80c3ac0161f5801abf7b19c60a515dc"
    },
    {
      "source": "docs/adopters/profiles.md",
      "target": "docs/adopters/profiles.md",
      "ownership": "managed",
      "state": "managed",
      "hash": "9ea5eeb1240ae12de0b5fe147fa6ecc823125f159b6bd50d1c79c52a8717196b"
    },
    {
      "source": "docs/adr/007-verifiable-recoverable-delivery.md",
      "target": "docs/adr/007-verifiable-recoverable-delivery.md",
      "ownership": "managed",
      "state": "managed",
      "hash": "17775287a35d97b7e69967c8068f4c3dba18b0a5ab20d0245bcd90147bae371b"
    },
    {
      "source": "docs/adr/009-incremental-onboarding.md",
      "target": "docs/adr/009-incremental-onboarding.md",
      "ownership": "managed",
      "state": "managed",
      "hash": "dfaa3ad62a984ae5d18c78d50481b3c8995a10683ae76ffccdba64fb950b0561"
    },
    {
      "source": "docs/agent-workflow.md",
      "target": "docs/agent-workflow.md",
      "ownership": "managed",
      "state": "managed",
      "hash": "22c9505782b2196b804872e2d34bf198da480d4021aabd96fdfb34c7fab73819"
    },
    {
      "source": "docs/capabilities.md",
      "target": "docs/capabilities.md",
      "ownership": "managed",
      "state": "managed",
      "hash": "10450a8c60242439b7f81b1d2d248a86434bc1ef2401615c75767a5d4b4c3b33"
    },
    {
      "source": "docs/delivery-release-acceptance.md",
      "target": "docs/delivery-release-acceptance.md",
      "ownership": "managed",
      "state": "managed",
      "hash": "6c42a5b7aeb008759d944e1cd5c76009364ae81c02589a24806b75e24b98867e"
    },
    {
      "source": "docs/evidence-contracts.md",
      "target": "docs/evidence-contracts.md",
      "ownership": "managed",
      "state": "managed",
      "hash": "76cc5c21b6d26ce42cdcd5a7f2b9e4b62c2bd7dc62c30c51c7a5e40b2d6b40a9"
    },
    {
      "source": "docs/intelligent-collaboration.md",
      "target": "docs/intelligent-collaboration.md",
      "ownership": "managed",
      "state": "managed",
      "hash": "48acd5bc6e440fac6dbeba4e480f66612b8cde511ec5765ff737fafd13a8cd6d"
    },
    {
      "source": "docs/issue-standards.md",
      "target": "docs/issue-standards.md",
      "ownership": "managed",
      "state": "managed",
      "hash": "e0c9d388a8e7a57607592ed765c9e7cbe32263569386e300ee92c0fa475814ae"
    },
    {
      "source": "docs/lifecycle-boundaries.md",
      "target": "docs/lifecycle-boundaries.md",
      "ownership": "managed",
      "state": "managed",
      "hash": "f17a3ec1f3fa68931c9a499d47d7692dcc2dbcd32f5627ba43e92c089524af06"
    },
    {
      "source": "docs/modular-architecture.md",
      "target": "docs/modular-architecture.md",
      "ownership": "managed",
      "state": "managed",
      "hash": "dbf097d949817774391b99d918dca5049bce53a1fa809843da875b28e4049d73"
    },
    {
      "source": "docs/providers/authoring.md",
      "target": "docs/providers/authoring.md",
      "ownership": "managed",
      "state": "managed",
      "hash": "adf2ed2e769092314bd8a007acc9fdf56624bc6a6af4cc9989842420a7d9fbd6"
    },
    {
      "source": "docs/providers/index.md",
      "target": "docs/providers/index.md",
      "ownership": "managed",
      "state": "managed",
      "hash": "35ddaf6acc989ef46bf0da4bb66fe5929b474c969dee6b2f56485c5d36855fa2"
    },
    {
      "source": "docs/providers/provider-matrix.md",
      "target": "docs/providers/provider-matrix.md",
      "ownership": "managed",
      "state": "managed",
      "hash": "c54135146f37cfc2fa7ceaee56bb4a40adc728026e0d7d0567adbb10eef3015e"
    },
    {
      "source": "docs/reliable-delivery.md",
      "target": "docs/reliable-delivery.md",
      "ownership": "managed",
      "state": "managed",
      "hash": "58a8e1e8e91ceede877ac2c86dfa3c4c4a0488e5bb19326d73ebbc0ce2219c06"
    },
    {
      "source": "docs/role-collaboration.md",
      "target": "docs/role-collaboration.md",
      "ownership": "managed",
      "state": "managed",
      "hash": "16b1233bdc8eb59d0ceafbbe8282bbe916d89e174b25fec2f5355b376c238e00"
    },
    {
      "source": "docs/roles/index.md",
      "target": "docs/roles/index.md",
      "ownership": "managed",
      "state": "managed",
      "hash": "d07e0673df22bf9d0ce29c71968339e1b25fd7bede214761820cdc8263d6eff0"
    },
    {
      "source": "docs/roles/methods.md",
      "target": "docs/roles/methods.md",
      "ownership": "managed",
      "state": "managed",
      "hash": "7290573d4bf75f3b4df9f87edbc629e7e381b4be974b245ea12f0cb6b886a04c"
    },
    {
      "source": "docs/run-operations.md",
      "target": "docs/run-operations.md",
      "ownership": "managed",
      "state": "managed",
      "hash": "ffed6703441d380612f34420e55a9b996aff41e5bfcc53bb1dfba30fd288efeb"
    },
    {
      "source": "docs/sdlc-definition.md",
      "target": "docs/sdlc-definition.md",
      "ownership": "managed",
      "state": "managed",
      "hash": "06ce747a7a3bb786b46d0c8527b5bcebfed98ba571d9a7999012b7df4cdd8c34"
    },
    {
      "source": "agents/templates/stack-conventions.md",
      "target": "docs/stack-conventions.md",
      "ownership": "seed-once",
      "state": "managed",
      "hash": "d580e73fd754d8faaef90021ecfb95a72b5885b2bdc50dba283e06fd8dbfa31e"
    },
    {
      "source": "lib/adoption/lock-validation.mjs",
      "target": "lib/adoption/lock-validation.mjs",
      "ownership": "managed",
      "state": "managed",
      "hash": "f110ac9adec38c97813f43661a16c2bdfd5901ac972c33aca9921b2039573daa"
    },
    {
      "source": "lib/adoption/operation-lock.mjs",
      "target": "lib/adoption/operation-lock.mjs",
      "ownership": "managed",
      "state": "managed",
      "hash": "6ab89b7b93886a590b3600414e608a5bd1d356b9837f11da353323e23a1451ea"
    },
    {
      "source": "lib/adoption/profiles.mjs",
      "target": "lib/adoption/profiles.mjs",
      "ownership": "managed",
      "state": "managed",
      "hash": "e4fa523f67bf491ff53c6375f8dc30d831d88513b46acf1f823f472bf9e8d370"
    },
    {
      "source": "lib/adoption/transaction.mjs",
      "target": "lib/adoption/transaction.mjs",
      "ownership": "managed",
      "state": "managed",
      "hash": "a62e296863977dc9bcd6f03e1d360989cc5ba094e00b78bf14f3f40f111da741"
    },
    {
      "source": "lib/application/context-service.mjs",
      "target": "lib/application/context-service.mjs",
      "ownership": "managed",
      "state": "managed",
      "hash": "d7b0b473c1f475bce7e86df4d2d9190286180ecc61be7ab99030c5283fd95f1e"
    },
    {
      "source": "lib/application/continuation-service.mjs",
      "target": "lib/application/continuation-service.mjs",
      "ownership": "managed",
      "state": "managed",
      "hash": "9a1ea75f02d8a9351cde7867993d5729056eed3fa3dd4510a34cd74c52d4538f"
    },
    {
      "source": "lib/application/local-cooperative-issuer.mjs",
      "target": "lib/application/local-cooperative-issuer.mjs",
      "ownership": "managed",
      "state": "managed",
      "hash": "e844d719216065f609b3cc4d5722c3b5e7e91734dd81515dcb30b142e8824efa"
    },
    {
      "source": "lib/application/onboarding-service.mjs",
      "target": "lib/application/onboarding-service.mjs",
      "ownership": "managed",
      "state": "managed",
      "hash": "be343cab0602bd548b7f0b72ccfabe81b1e8a13810b87fe004406549372bc844"
    },
    {
      "source": "lib/application/publication-service.mjs",
      "target": "lib/application/publication-service.mjs",
      "ownership": "managed",
      "state": "managed",
      "hash": "8be3486e45773b7190655f03271d5f0634c70363023ea2a476da22341e820fdd"
    },
    {
      "source": "lib/application/run-service.mjs",
      "target": "lib/application/run-service.mjs",
      "ownership": "managed",
      "state": "managed",
      "hash": "2090d2bc69a0ccea1c33ecc904ccdb7eb8c82d97cb4274c95a420c35b1ac4d22"
    },
    {
      "source": "lib/collaboration-plan.mjs",
      "target": "lib/collaboration-plan.mjs",
      "ownership": "managed",
      "state": "managed",
      "hash": "6ea8fc015fbaca0114dfc58dad73d2d730783a4994445c17a2ed022e51f705be"
    },
    {
      "source": "lib/config/authority.mjs",
      "target": "lib/config/authority.mjs",
      "ownership": "managed",
      "state": "managed",
      "hash": "b87d504f26b56d962ed27ca686c1fd4417f373e82619f4753ac87b7839a3aecd"
    },
    {
      "source": "lib/core/artifact-ref.mjs",
      "target": "lib/core/artifact-ref.mjs",
      "ownership": "managed",
      "state": "managed",
      "hash": "3de2da8eae1f207191e672dc96761f08ddfcf69cbb8ab9d85c9adb86ae7e979d"
    },
    {
      "source": "lib/core/collaboration-intent.mjs",
      "target": "lib/core/collaboration-intent.mjs",
      "ownership": "managed",
      "state": "managed",
      "hash": "ed76370b9260f65c5fba8c59fda85c44e47865f895cadd508e8266fee489e472"
    },
    {
      "source": "lib/core/delegation-grant.mjs",
      "target": "lib/core/delegation-grant.mjs",
      "ownership": "managed",
      "state": "managed",
      "hash": "d1f5ba8893b31ca3c8c811c8e05f05c0769746156a12cfa6e9365380c68f8f10"
    },
    {
      "source": "lib/core/delivery-policy.mjs",
      "target": "lib/core/delivery-policy.mjs",